Place_Name,Description,Location,Adventure,Relax,Rural,Urban,Mountain,Historical,Food,Nature
Dray Nur Waterfall,"Dray Nur Waterfall, located in Dak Lak province, is one of the most beautiful and majestic waterfalls of the Central Highlands. This waterfall is located on the Serepok river, famous for its wild and mysterious beauty",Dak Lak,0,0,0,0,1,0,0,1
World Coffee Museum,"World Coffee Museum, located in Buon Ma Thuot, Dak Lak, is an attractive destination for those who love coffee and want to learn about global coffee culture.",Dak Lak,0,0,0,1,0,1,0,0
Ko Tam tourist area,"Ko Tam tourist area, located in Buon Ma Thuot, Dak Lak, is an outstanding ecological and cultural destination of the Central Highlands. With an area of ​​about 13 hectares, Ko Tam offers visitors a wild and peaceful natural space, along with the unique cultural features of the Ede ethnic people.",Dak Lak,0,1,0,0,1,0,0,0
Dak Nong Geopark,"Dak Nong Geopark is famous for its unique volcanic cave system, including nearly 50 caves with a total length of more than 10,000 meters. Dak Nong Geopark is not only a place to preserve geological values, but also a place to preserve and introduce the culture of indigenous ethnic groups such as the Ma, Mnong and Ede people.",Dak Nong,1,0,0,0,0,0,0,0
Dray Sap Waterfall,"Dray Sap Waterfall, also known as Smoke Waterfall, is one of the most beautiful and majestic waterfalls of the Central Highlands",Dak Nong,0,0,0,0,1,0,0,1
Chu Bluk Cave,"Chu Bluk Cave, located in Krong No district, Dak Nong province, is the longest volcanic cave system in Southeast Asia. Chu Bluk Cave stands out for its wild and mysterious beauty, with unique basalt structures and a rich ecosystem. This is an ideal destination for those who love exploration and adventure, because accessing the cave is not easy and requires guidance from local people.",Dak Nong,1,0,0,0,0,0,0,1
Ea Sno Lake,"Ea Sno Lake is surrounded by a rich and diverse plant ecosystem, and is home to many indigenous ethnic communities. The scenery here brings a feeling of peace and relaxation",Dak Nong,0,0,0,0,0,0,0,1
Nam Nung Nature Reserve,"The reserve is located in Dak Nong province, famous for its diverse ecosystem including primeval forests, majestic waterfalls and many rare flora and fauna species. This is an ideal location for nature exploration, trekking, and ecological research activities.",Dak Nong,1,0,0,0,0,0,0,1
Hill A1,"Hill A1 is one of the important historical relics in the Dien Bien Phu campaign, where fierce battles took place. Currently, this place has become a tourist attraction with a fighting bunker, a trench system and the preservation of many historical artifacts.",Dien Bien,0,0,0,0,1,1,0,0
De Castries Tunnel,This was the residence and command of General De Castries during the Dien Bien Phu campaign. The tunnel was built solidly and is now a historical relic preserved to recreate the battlefield of the past.,Dien Bien,0,0,0,0,0,1,0,0
Dien Bien Phu Victory Museum,"The museum preserves artifacts, documents and images of the Dien Bien Phu campaign, recreating the heroic history of the Vietnamese people. This is a destination not to be missed when visiting Dien Bien.",Dien Bien,0,0,0,1,0,1,0,0
Muong Thanh fields,"The largest rice field in the Northwest region, famous for its poetic beauty and important role in the history of the Dien Bien Phu campaign. The landscape here changes with the seasons, attracting many tourists to admire.",Dien Bien,0,0,0,0,0,1,0,1
Dien Bien Phu Victory Monument,"The monument is located on hill D1, a symbol of the historic victory of Dien Bien Phu. This is a place to honor the sacrifices and victories of Vietnamese soldiers, and is also a panoramic view of Dien Bien city.",Dien Bien,0,0,0,1,1,0,0,0
Cat Tien National Park,"One of the most famous national parks in Vietnam, located in Dong Nai province. This place possesses a rich ecosystem with many rare flora and fauna species, along with activities such as forest exploration, bird watching and picnics.",Dong Nai,1,0,0,0,0,0,0,1
Buu Long tourist area,"Considered a ""miniature Ha Long Bay"" in Dong Nai, Buu Long stands out with its clear blue lake, rocky mountains and poetic landscape. This is an ideal place for picnics, camping and photography.",Dong Nai,0,0,0,0,1,0,0,1
Tri An Lake,"Tri An Lake with over 70 large and small islands, many of which are inhabited, plus a few large islands that have been exploited for tourism in the past ten years have become the highlight of Tri An river and water.",Dong Nai,0,0,0,1,0,0,0,1
Eagle Island,"An island located in the middle of Tri An lake, possessing a green and fresh space. Eagle Island is an attractive destination for picnicking, camping, and enjoying nature.",Dong Nai,0,1,0,0,0,0,0,1
Giang Dien Waterfall,"A beautiful waterfall in Dong Nai, surrounded by cool green forests. Giang Dien Waterfall is an attractive eco-tourism destination for relaxation activities, picnics and commemorative photos.",Dong Nai,0,0,0,0,0,0,0,1
Tram Chim National Park,"National park in Dong Thap, which preserves the typical wetland ecosystem of the Mekong Delta. Tram Chim is home to many rare bird species, especially red-crowned cranes.",Dong Thap,1,0,0,0,0,0,0,1
Sa Dec flower village,"Famous traditional craft village in Dong Thap, where hundreds of beautiful and precious flower species are grown. The flower village attracts tourists with brilliant flower gardens all year round.",Dong Thap,0,0,1,0,0,0,0,0
Xeo Quyt relic site,"A historical relic combined with eco-tourism in Dong Thap, where revolutionary bases are recreated in the Melaleuca forest during the resistance war.",Dong Thap,0,0,0,0,0,1,0,1
Mausoleum of Nguyen Sinh Sac,"The resting place of Mr. Nguyen Sinh Sac, father of President Ho Chi Minh. The mausoleum is designed in harmony between architecture and natural landscape.",Dong Thap,0,0,0,0,0,0,0,1
Cao Lanh Market,"A bustling market in Cao Lanh city, where visitors can explore culinary culture and local people's lives.",Dong Thap,0,0,0,1,0,0,1,0
Tonle Sap Lake,"A bustling market in Cao Lanh city, where visitors can explore culinary culture and local people's lives.",Gia Lai,0,0,0,1,0,0,1,1
Phu Cuong Waterfall,"A beautiful waterfall in Gia Lai, located in the middle of a primeval forest. The waterfall stands out with its white water flowing from a height of more than 45m.",Gia Lai,0,0,0,0,0,0,0,1
Minh Thanh Pagoda,"Famous temple in Gia Lai, built in Japanese Buddhist style, with unique architecture and pure space.",Gia Lai,0,1,0,0,0,0,0,0
Great Solidarity Square,"The largest square in the Central Highlands, located in Pleiku, Gia Lai. This is where major events are held and is also a symbol of national unity.",Gia Lai,0,0,0,0,1,0,0,0
Bau Can tea hill,"Bau Can tea hill in Gia Lai is one of the oldest tea hills in Vietnam, outstanding with long green tea beds, bringing peaceful beauty. This is the ideal destination to relax and take photos amidst the fresh natural space.",Gia Lai,0,1,0,0,1,0,0,0
Lung Cu flagpole,"Lung Cu flagpole, located in the northernmost part of Vietnam (Ha Giang), is a sacred symbol of national sovereignty. Visitors conquer nearly 800 steps to admire the red flag with yellow star flying on the majestic mountain top.",Ha Giang,0,0,0,0,1,0,0,0
Ma Pi Leng Pass,"Ma Pi Leng Pass is a majestic road in Ha Giang, with the emerald Nho Que River winding below. This is an attraction for backpackers and tourists who love wild natural beauty.",Ha Giang,0,0,0,0,1,0,0,0
Dong Van ancient town,Dong Van ancient town (Ha Giang) preserves ancient architecture with houses with earthen walls and yin-yang tile roofs. The bustling weekend market is an attractive cultural highlight.,Ha Giang,0,0,1,1,0,1,1,0
Tu San Alley,"Tu San Alley, the deepest place in Southeast Asia, stands out with 800m high cliffs and the blue Nho Que river. Visitors can row boats to explore this magnificent scenery.",Ha Giang,0,0,0,0,0,0,0,0
Cat King's Palace,"King Meo Palace (Ha Giang) is an ancient mansion of the Vuong family, with a unique architectural combination of Chinese, French and H'Mong ethnic culture, attracting many tourists.",Ha Giang,0,0,0,0,0,1,0,0
Tam Chuc Pagoda,"Tam Chuc Pagoda (Ha Nam) is one of the largest pagoda complexes in Vietnam, standing out with its majestic architecture and beautiful natural landscape. Surrounded by mountains and clear blue lakes, this is a place that attracts Buddhists and tourists.",Ha Nam,0,1,0,0,1,0,0,1
Tran Thuong Temple,"Tran Thuong Temple (Ha Nam) worships the Tran kings, standing out with its ancient architecture and pure space. The temple is a cultural and spiritual destination, attracting tourists during the festival season.",Ha Nam,0,1,0,0,0,1,0,0
Luon Cave,"Luon Cave, located in the Ha Long relic area, Quang Ninh, is famous for its magnificent cave system. Visitors can row boats into the cave and explore the wild beauty of nature.",Ha Nam,1,0,0,0,0,1,0,0
Lanh Giang Temple,"Lanh Giang Temple (Hung Yen) is a historical relic worshiping heroic kings, rich in cultural and historical value. This is a prominent spiritual tourist destination in the North.",Ha Nam,0,1,0,0,0,1,0,0
Vu Dai Village,"Vu Dai village (Ha Nam) is famous for its association with the work ""Chi Pheo"" by writer Nam Cao. This place has ancient houses, is a cultural tourist destination, where traditional cultural beauty is preserved.",Ha Nam,0,0,1,0,0,1,0,0
Ho Chi Minh Mausoleum,"President Ho Chi Minh Mausoleum (Hanoi) is where the body of President Ho Chi Minh is kept, becoming a symbol of respect and gratitude of the Vietnamese people.",Hanoi,0,0,0,0,0,0,0,0
Sword Lake,"Sword Lake (Hanoi) is the center of the capital, notable for its Turtle Tower and The Huc Bridge. This is an attractive tourist destination, where people relax and is a symbol of Hanoi.",Hanoi,0,0,0,1,0,0,0,1
Temple of Literature - National Tu Giam,"Temple of Literature - Quoc Tu Giam (Hanoi) is a historical and cultural relic, a place of worship for Confucius and the first university in Vietnam. This is an educational and cultural attraction.",Hanoi,0,1,0,0,0,1,0,0
Imperial Citadel of Thang Long,"The Imperial Citadel of Thang Long (Hanoi) is an important historical site in Vietnam, once the center of power for many dynasties. This relic bears a strong mark of national history and culture.",Hanoi,0,0,0,0,0,1,0,0
Long Bien Bridge,"Long Bien Bridge (Hanoi) is one of the oldest bridges, imbued with historical value. The bridge connects the two banks of the Red River and is a symbol of the capital.",Hanoi,0,0,0,1,0,0,0,0
Dong Loc intersection,Dong Loc intersection (Ha Tinh) is a famous historical site associated with the resistance war against the US. This is a place to commemorate the martyrs who died in the war.,Ha Tinh,0,0,0,0,0,1,0,0
Huong Tich Pagoda,Dong Loc intersection (Ha Tinh) is a famous historical site associated with the resistance war against the US. This is a place to commemorate the martyrs who died in the war.,Ha Tinh,0,1,0,0,0,1,0,0
Thien Cam Beach,"Thien Cam Beach (Ha Tinh) is a beautiful beach with long sandy beaches and clear blue sea water, where visitors can relax and participate in marine sports activities.",Ha Tinh,0,1,0,0,0,0,0,0
Nguyen Du relic site,"Nguyen Du relic site (Ha Tinh) is a place to commemorate the great poet Nguyen Du, author of ""The Tale of Kieu"". This monument preserves the cultural and historical values ​​of his life and career.",Ha Tinh,0,0,0,0,0,1,0,0
Ngang Pass,"Ngang Pass (Quang Binh) is one of the most beautiful passes in Vietnam, connecting the two provinces of Quang Binh and Ha Tinh. The pass has majestic and poetic scenery.",Ha Tinh,0,0,0,0,1,0,0,0
Chi Lang Nam Stork Island,"Chi Lang Nam Stork Island (Hai Duong) is an outstanding nature reserve area with thousands of storks living. This is an ideal eco-tourism destination, with a peaceful space and beautiful landscape.",Hai Duong,0,1,0,0,0,0,0,1
Con Son Pagoda,"Con Son Pagoda (Hai Duong) is a historical and cultural relic, outstanding with ancient architecture and pure space. This place is one of the famous spiritual tourist destinations in the North.",Hai Duong,0,1,0,0,0,1,0,0
Qinghai Water Puppet Village,Thanh Hai Water Puppet Village (Hai Duong) is a place to preserve and develop traditional water puppetry art. Visitors can enjoy unique puppet shows in a rich folk culture space.,Hai Duong,0,1,1,0,0,0,0,0
Kiep Bac Temple,"Kiep Bac Temple (Hai Duong) is the place to worship Hung Dao Dai Vuong Tran Quoc Tuan, who had great contributions in the war against Nguyen. The temple is rich in historical and cultural value.",Hai Duong,0,1,0,0,0,1,0,0
Dong Ngo Quyen Market,Dong Ngo Quyen Market (Hai Phong) is a famous traditional market with a variety of products and bustling atmosphere. The market is a trading place for locals and tourists.,Hai Duong,0,0,0,1,0,0,1,0
Do Son,Do Son (Hai Phong) is a beautiful beach famous for its mountains and blue sea. This is a beach resort with water sports activities and relaxation under the sun.,Hai Phong,0,1,0,0,1,0,0,0
Cat Ba,Cat Ba (Hai Phong) is a famous island with beautiful beaches and diverse ecosystems. This place is an ideal destination for those who love eco-tourism and the sea.,Hai Phong,0,1,0,0,0,0,0,1
Ben Nghieng - Wharf K15,"Ben Nghieng (Bent K15) (Quang Ninh) is a famous port, associated with war history. This is one of the important historical sites of the North.",Hai Phong,0,0,0,0,0,1,0,0
Hon Dau Lighthouse,"Hon Dau Lighthouse (Hai Phong) is an ancient lighthouse, located on Hon Dau Island. This is one of the important lighthouses in the Gulf of Tonkin region.",Hai Phong,0,0,0,0,0,1,0,0
Hoang Van Thu Bridge,Hoang Van Thu Bridge (Hai Phong) is a vital bridge connecting areas in the city. The bridge stands out with its modern architecture and is the main tourist destination for tourists.,Hai Phong,0,0,0,1,0,0,0,0
Lung Ngoc Hoang tourist area,Lung Ngoc Hoang tourist area (Hau Giang) is an outstanding nature reserve with a mangrove ecosystem. This is an ideal destination for those who love eco-tourism and plant and animal research.,Hau Giang,0,0,0,0,0,0,0,1
Nga Bay floating market,Nga Bay floating market (Hau Giang) is one of the famous floating markets in the West. Visitors can experience shopping on the river and explore the unique floating market culture.,Hau Giang,0,0,0,1,0,0,1,0
Vinpearl Hau Giang amusement park,"Vinpearl Hau Giang Amusement Park is a modern entertainment area, with many attractive games for the whole family. This is an ideal destination for travelers looking for entertainment and relaxation.",Hau Giang,1,0,0,0,0,0,0,0
Tan Long stork garden,"Tan Long Stork Garden (Vinh Long) is an ecological conservation area, where thousands of storks live. Visitors can watch flocks of storks flying in a peaceful space.",Hau Giang,0,1,0,0,0,0,0,0
Cai Lon River,"Cai Lon River (Ca Mau) is a long river, flowing through the Western provinces. This place has a rich ecosystem and is an outstanding eco-tourism destination of the Mekong Delta.",Hau Giang,0,0,1,0,0,0,0,1
Thung Nai,"Thung Nai (Hoa Binh) is a famous tourist area with majestic natural scenery, including a large lake and surrounding mountains. This is an ideal place for tourists who love eco-tourism and participating in outdoor activities such as boating.",Hoa Binh,0,0,0,0,1,0,0,1
Mai Chau,"Mai Chau (Hoa Binh) is a beautiful valley, famous for its stilt houses and pristine natural scenery. Mai Chau attracts tourists because of its fresh air, plus the unique culture of the Thai ethnic people.",Hoa Binh,0,0,0,0,0,0,0,0
Silver Stone Cave,Da Bac Cave (Quang Ninh) is an outstanding natural cave with strange limestone blocks and mysterious beauty. Visitors can explore the stalactite system and unique rock formations in the quiet space of the cave.,Hoa Binh,1,1,0,0,0,0,0,0
Nine waterfalls Tu Son,Nine waterfalls Tu Son (Ha Giang) is a system of 9 large and small waterfalls located in the middle of pristine nature. This is an ideal destination for those who love to explore and learn about waterfalls amidst the mountains and forests.,Hoa Binh,0,0,0,1,1,0,0,1
Thac Bo Temple,"Thac Bo Temple (Hoa Binh) is a historical relic, worshiping female general Cao Thi Lich. The temple is located near Bo waterfall, has a mysterious scenery and is a sacred place, attracting tourists to visit and pray.",Hoa Binh,0,1,0,0,0,1,0,1
Pho Hien,"Pho Hien (Hung Yen) is a famous old town with historical architectural works. This is an attractive destination for tourists who want to learn about history, culture and enjoy local cuisine.",Hung Yen,0,0,0,0,0,1,1,0
Chuong Pagoda,"Chuong Pagoda (Hanoi) is an ancient temple with unique architecture, located in a spacious and peaceful campus. This is a famous pilgrimage site, attracting many Buddhists and tourists to visit.",Hung Yen,0,1,0,0,0,1,0,0
Long Thuong bronze casting village,Long Thuong bronze casting village (Hanoi) is famous for its long-standing traditional bronze casting craft. Visitors can visit the production process of handicraft copper products and learn about the history of the craft village.,Hung Yen,0,0,1,0,0,1,0,0
Phu Ung Temple,"Phu Ung Temple (Hung Yen) is a historical relic, worshiping Saint Phu Ung, who helped King Hung in the wars. The temple is located in a large campus, with a pure and sacred space.",Hung Yen,0,1,0,0,0,1,0,0
Nom village communal house,"Nom village communal house (Hung Yen) is a unique cultural relic, outstanding with traditional architecture and folk festival activities. This is a destination that attracts tourists to explore traditional cultural values.",Hung Yen,0,0,1,0,0,1,0,0
